{
  "$schema": "https://json-schema.org/draft/2020-12/schema",
  "$id": "https://github.com/edithatogo/reimbursement-atlas/blob/main/data/licence_review/decision.schema.json",
  "title": "Reimbursement Atlas licence review decision",
  "description": "Schema for an accountable human decision bound to one generated queue row.",
  "type": "object",
  "additionalProperties": false,
  "required": [
    "review_id",
    "relative_path",
    "checksum_sha256",
    "decision",
    "reviewer",
    "reviewed_at",
    "source_terms",
    "attribution",
    "redistribution_permission",
    "restrictions",
    "evidence"
  ],
  "properties": {
    "review_id": { "type": "string", "minLength": 1 },
    "relative_path": { "type": "string", "minLength": 1 },
    "checksum_sha256": { "type": "string", "pattern": "^[0-9a-f]{64}$" },
    "decision": { "enum": ["approved", "blocked"] },
    "reviewer": { "type": "string", "minLength": 1 },
    "reviewed_at": { "type": "string", "pattern": "^[0-9]{4}-[0-9]{2}-[0-9]{2}$" },
    "source_terms": { "type": "string", "minLength": 1 },
    "attribution": { "type": "string", "minLength": 1 },
    "redistribution_permission": { "type": "string", "minLength": 1 },
    "restrictions": { "type": "string", "minLength": 1 },
    "evidence": { "type": "string", "minLength": 1 }
  }
}
