{"attribution":"Reimbursement Atlas project-owned derived graph metadata.","checksum_sha256":"0e69c3af3194f46a3b34e42c48abd91802061cc8b8beb059775329aeb85c7505","decision":"approved","evidence":"Explicit repository-owner approval; current checksum verified against the generated queue. Metadata-only graph output.","redistribution_permission":"Approved for public derived metadata publication.","relative_path":"data/seed/graph_nodes.csv","restrictions":"Exclude credentials, confidential values and raw source payloads.","review_id":"licence_review_c667fdb420c87e5f","reviewed_at":"2026-07-29","reviewer":"repository-owner","source_terms":"Project-owned derived graph metadata."}
