{"attribution":"Reimbursement Atlas project-owned derived quality metadata.","checksum_sha256":"7be4983cefc9fa6704ddae79955ce10955a513aa187888e4bbcd3afac8f35950","decision":"approved","evidence":"Explicit repository-owner approval; current checksum verified against the generated queue. Metadata-only derived output.","redistribution_permission":"Approved for public derived metadata publication.","relative_path":"data/derived/data_quality/data_quality_checks.csv","restrictions":"Exclude raw payloads, credentials, confidential values and restricted descriptors.","review_id":"licence_review_cc9087bd3de7307f","reviewed_at":"2026-07-29","reviewer":"repository-owner","source_terms":"Project-owned derived metadata with source-specific provenance retained in the repository."}
