{"attribution":"Reimbursement Atlas project-owned project export metadata.","checksum_sha256":"ba78076aaa99c4608bd850611a2f603d5e880a9cc303e40f04c324ea313e3d17","decision":"approved","evidence":"Explicit repository-owner approval; current checksum verified against the generated queue. Metadata-only project export.","redistribution_permission":"Approved for public derived metadata publication.","relative_path":"data/derived/github_project/github_project_items.jsonl","restrictions":"Exclude credentials, confidential values and raw source payloads.","review_id":"licence_review_a9d6e64b4a2fd3c3","reviewed_at":"2026-07-29","reviewer":"repository-owner","source_terms":"Project-owned metadata with Conductor provenance."}
