{"attribution":"Reimbursement Atlas project-owned derived quality metadata.","checksum_sha256":"c1032c2b26c32409466dda586c96e4a80d33e56437720b3a0011c850c16b796d","decision":"approved","evidence":"Explicit repository-owner approval; current checksum verified against the generated queue. Metadata-only derived output.","redistribution_permission":"Approved for public derived metadata publication.","relative_path":"data/derived/data_quality/data_quality_checks.jsonl","restrictions":"Exclude raw payloads, credentials, confidential values and restricted descriptors.","review_id":"licence_review_8f2eddaed2e30bc3","reviewed_at":"2026-07-29","reviewer":"repository-owner","source_terms":"Project-owned derived metadata with source-specific provenance retained in the repository."}
