{
  "attribution": "Reimbursement Atlas project-owned project export metadata.",
  "checksum_sha256": "f5e26bdac7f632f68e28810bf7147516e6da4ff50b64a271b05a17c9cb986b9e",
  "decision": "approved",
  "evidence": "Explicit repository-owner approval; checksum and current queue path verified. Project rows contain governed metadata only.",
  "redistribution_permission": "Approved for public derived metadata publication within the Reimbursement Atlas publication manifest.",
  "relative_path": "data/derived/github_project/github_project_items.jsonl",
  "restrictions": "Exclude credentials, confidential values, raw source payloads and restricted descriptors.",
  "review_id": "licence_review_a9d6e64b4a2fd3c3",
  "reviewed_at": "2026-07-29",
  "reviewer": "repository-owner",
  "source_terms": "Project-owned metadata; provenance and transformation details are retained in Conductor and project export manifests."
}
