{"attribution":"Reimbursement Atlas project-owned Conductor metadata.","checksum_sha256":"e283587ebe2eb354eb9915163e5128a050461e218df83de0de0b5bce779179ea","decision":"approved","evidence":"Explicit repository-owner approval; current checksum verified against the generated queue. Metadata-only project control record.","redistribution_permission":"Approved for public project metadata publication.","relative_path":"data/seed/conductor_tracks.jsonl","restrictions":"Exclude credentials, confidential values and raw source payloads.","review_id":"licence_review_3f1452350edbebe4","reviewed_at":"2026-07-29","reviewer":"repository-owner","source_terms":"Project-owned Conductor metadata."}
