{"attribution":"Reimbursement Atlas project-owned project export metadata.","checksum_sha256":"e09eeba2bfab12a60f9dcb551bdaf4d87308eacbf064b84a2355953025d7b358","decision":"approved","evidence":"Explicit repository-owner approval; current checksum verified against the generated queue. Metadata-only project export.","redistribution_permission":"Approved for public derived metadata publication.","relative_path":"data/derived/github_project/github_project_items.csv","restrictions":"Exclude credentials, confidential values and raw source payloads.","review_id":"licence_review_6bbb168b51317fb0","reviewed_at":"2026-07-29","reviewer":"repository-owner","source_terms":"Project-owned metadata with Conductor provenance."}
