{"attribution":"Reimbursement Atlas project-owned Conductor metadata.","checksum_sha256":"12a36257c6e92f7207e0483425d1fa0123280bf620b897441fa1b52acec6803a","decision":"approved","evidence":"Explicit repository-owner approval; current checksum verified against the generated queue. Metadata-only project control record.","redistribution_permission":"Approved for public project metadata publication.","relative_path":"data/seed/conductor_tracks.csv","restrictions":"Exclude credentials, confidential values and raw source payloads.","review_id":"licence_review_518af3667fb4585b","reviewed_at":"2026-07-29","reviewer":"repository-owner","source_terms":"Project-owned Conductor metadata."}
