{"attribution":"Reimbursement Atlas project-owned derived graph metadata.","checksum_sha256":"e48d83ceff4d14598264d4d24b3609a15001e4377b8fe158c11a1bc056321424","decision":"approved","evidence":"Explicit repository-owner approval; current checksum verified against the generated queue. Metadata-only graph output.","redistribution_permission":"Approved for public derived metadata publication.","relative_path":"data/seed/graph_edges.csv","restrictions":"Exclude credentials, confidential values and raw source payloads.","review_id":"licence_review_811b764ee91911a8","reviewed_at":"2026-07-29","reviewer":"repository-owner","source_terms":"Project-owned derived graph metadata."}
